{
  "schemaVersion": "1.0.0",
  "ok": true,
  "receiptId": "ts_src_prop_demo_001_abcdef01",
  "sourceProjectId": "proj-001",
  "sourceProjectSlug": "demo",
  "panelPath": "trafego/PAINEL-DA-SEMANA.yaml",
  "angleCount": 2,
  "entities": {
    "marketingProjectId": "11111111-1111-4111-8111-111111111111",
    "briefRevisionId": "22222222-2222-4222-8222-222222222222",
    "campaignId": "33333333-3333-4333-8333-333333333333",
    "campaignPlanRevisionId": "44444444-4444-4444-8444-444444444444",
    "unitEconomicsId": "33333333-3333-4333-8333-333333333333",
    "artifactIds": ["55555555-5555-4555-8555-555555555555"]
  },
  "hashes": { "proposalHash": "abcdef0123456789abcdef0123456789" },
  "deepLink": "http://127.0.0.1:5177/projects/demo?receipt=ts_src",
  "publishedUrl": "https://example.com"
}
